{
  "$schema": "http://json-schema.org/draft-07/schema#",
  "title": "BugFixGlyph",
  "type": "object",
  "required": [
    "intent",
    "issue",
    "artefact",
    "constraints",
    "reward_functions"
  ],
  "properties": {
    "intent": {
      "const": "bug_fix"
    },
    "issue": {
      "type": "string"
    },
    "artefact": {
      "type": "object",
      "required": [
        "language",
        "code"
      ],
      "properties": {
        "language": {
          "type": "string"
        },
        "code": {
          "type": "string"
        }
      }
    },
    "constraints": {
      "type": "array",
      "items": {
        "type": "string"
      }
    },
    "reward_functions": {
      "type": "array",
      "items": {
        "type": "string"
      }
    },
    "meta": {
      "type": "object"
    }
  }
}