{
  "intent": "bug_fix",
  "constraints": [
    "no PII",
    "cite sources",
    "pass tests"
  ],
  "reward_functions": [
    "accuracy",
    "safety",
    "latency"
  ],
  "meta": {
    "id": "sample_081",
    "seed": 81
  },
  "issue": "Fix edge-case #081",
  "artefact": {
    "language": "python",
    "code": "print('hello world 81')"
  }
}